<!ELEMENT Gedichtsammlung (Gedicht)+>
<!ELEMENT Gedicht (Autor,Titel,Untertitel?,Strophe+)>
<!ATTLIST Gedicht 
    Erscheinungsjahr CDATA #IMPLIED
    Sprache CDATA #IMPLIED    
>
<!ELEMENT Autor (Vorname,Nachname)>
<!ELEMENT Vorname (#PCDATA)>
<!ELEMENT Nachname (#PCDATA)>
<!ELEMENT Titel (#PCDATA)>
<!ELEMENT Untertitel (#PCDATA)>
<!ELEMENT Strophe (Vers)+>
<!ELEMENT Vers (#PCDATA|Fett)*>
<!ELEMENT Fett (#PCDATA)>
